system_id,sentence
365,檢討歲以上老人造成的萬件車禍為何不順便檢討另萬件交通事故
365,三寶不分年齡頂多會老
365,如果換照可解決三寶問題
365,建議不分年齡
365,有駕照的每年換照次
365,接
365,統
365,人
365,時
365,加
365,形
365,信
365,交
365,照
365,繼
365,成
365,人
365,理
365,齡
365,就
365,始
365,至
365,險
365,測
365,三
365,有
365,年
365,緩
365,的
365,台灣歲以上人口佔
365,歲以上歲以下約佔
365,用車禍事故件數跟百分比換算
365,歲以上每車禍件數件
365,每車禍件數件
365,請問有到天差地遠嗎
366,拜託大家集氣幫老翁集氣可以度過這關
366,快快醒過來做筆錄然後苟延殘喘的活到歲
366,不能這麼容易走掉欸不指望你賠得起
366,但不能高歌離席是基本的
366,好好活著忍受病痛纏身吧
367,各位鄉民中午
367,國立臺北大學，簡稱北大，是中華民國臺灣所國立大學，現校本部位於新北市三峽，既然在新北市三峽，為啥不叫新北大學或三峽大學呢
368,陳怡伶報導
368,三峽車禍歲翁奪模範父親
368,老師踢爆恐怖黑料水很深
368,新北三峽北大國小前車禍，歲余姓老翁汽車失控暴衝，撞死名國中女學生名家長
368,而余翁被起底曾奪過模範父親，知情者爆料黑料，水很深
368,歲余男肇事後，出現臟器受損嚴重血胸腹腔出血等問題，目前正在加護病房搶救中
368,里長則是直言，余男曾榮獲模範父親，還是鄉裡的環保志工，為人相當熱心善良，懷
368,疑恐是舊疾心臟病發作，導致車禍發生
368,而模範父親這頭銜，立刻在上引起激烈討論
368,名網友表示，上課的時候
368,，
368,另外，還有網友分享親身經歷說，他爸爸除了高壽身體健康外，並沒有特殊優點，而且
368,兒女只是般上班族，家境也很普通，更沒有捐錢捐血習慣
368,該名網友進步說，但某天區公所打電話來家中，來問我爸，說要推薦他做本屆的模範
368,父親，到時候會請他上台領獎，他爸爸最終也拒絕，只能說當模範父親並不能代表什麼
368,，因為入選並不困難
368,////
369,大家好，我是八卦優文子啦
369,買便當的時候，聽到內用的年輕人跟老人在說話，他們在討論三峽車禍事件，結果年輕人
369,說這要是在對岸，就會被判死刑了啦，台灣只會輕輕放下
369,殊不知，老人就口氣很差的回答說這麼喜歡對岸不會游過去嗎，台灣海峽可沒有加蓋
369,那年輕人就不知道要回答什麼了
369,有沒有反應激烈的老人的八卦
369,///
369,喵在床上睡覺，安全多了
370,女口是頁
370,之前我們某個模範青年
370,因為偷拍與未成年愛愛
370,被撤銷模範青年的資格
370,同理，
370,這次三峽出事的模範父親
370,也可以撤銷模範父親的資格名譽頭銜嗎
370,真的害死人耶
371,尿袋力量的數字應該來自於道安總動員主題分析年齡
371,歲以上全國件數
371,~歲全國件數
371,~歲全國件數
371,~歲全國件數
371,~歲全國件數
371,按每萬人算比例
371,以上共萬人/十萬人
371,~共萬人/十萬人
371,~共萬人/十萬人
371,~共萬人/十萬人
371,~共萬人/十萬人
371,從數字來看尿袋力量的數字很沒說服力
371,反而應該檢討合法上路年齡是不是要再上修
372,你今天無緣無故撞人導致那麼多人受傷還有年輕生命這樣就沒有
372,怎從昨天晚上開始堆新聞都在洗他是模範父親
372,所以當選過模範父親可以這樣亂撞人
372,到底是哪些新聞台在那邊漂白
373,不只是老人的問題
373,很多中年的駕駛技術跟反應也不過關市區的交通太亂了
373,應該要結合考照
373,虛擬實境裡面模擬各種三寶行為要針對駕駛人建立起防禦駕駛的機制
373,公車靠站往右切然後卡到乘客下車撞上乘客
373,計程車突然靠右停車
373,路邊停車突然開門撞上門
373,後方大車轉彎硬塞內側被擦撞
373,考照分級制沒通過考照的禁止進市區道路
373,機車比照辦理
373,開放機車上高速公路但要通過高速公路版機車駕照考試始可上路
373,如有三寶行為造成交通事故就吊扣駕照
374,媒體來源
374,記者署名記者趙于婷台北報導
374,完整新聞標題快訊歲駕駛尚未脫險意識模糊將進行第次手術
374,完整新聞內文
374,新北市三峽區北大國小旁發生重大車禍，亞東醫院第時間協助收治傷患，其中包含歲
374,肇事駕駛
374,亞東醫院今表示，目前還有人住院中，位是學童，位還在加護病房觀察，
374,駕駛則是術後還未脫離險境，意識狀況仍不清楚生命現象不穩定，將進行二次手術
374,亞東醫院主任醫師林恆甫指出，目前還有人住院中，位是學童，位已經完成手術縫合
374,，目前在接受兒童心理支持，
374,另位學童完成第階段的骨頭手術，情況相對穩定，由於
374,大腿骨折還需要進行下階段手術，目前還在加護病房觀察
374,至於駕駛狀況，林恆甫坦言，
374,駕駛到院後情況相當危急，有多處腸道破裂，創傷團隊搶救
374,手術後還未脫離險境，意識狀況不清楚，今天會再進行第次剖腹探查和腸道處理
374,他強
374,調，該駕駛意識狀況仍不清楚生命現象不穩定，還需要做階段性手術，家屬有依照正常
374,程序聯繫
374,另名洪姓女子急救時間長達個半小時，但生命跡象仍未恢復，家屬趕到之後，傷者在
374,晚間點多離世，院內目前全力協助家屬
374,完整新聞連結
374,/////
374,備註
375,這個統計不是針對歲以上開車造成的事故
375,是歲以上包括行人在內發生的所有事故
375,///
375,///
375,年自用小客車
375,交通事故件數
375,"全體,件"
375,"歲以上,件"
375,交通事故死亡人數
375,全體人
375,歲以上人
375,歲以上人口比例
375,歲以上人口比例
375,歲人口占歲以上
375,歲以上自行開車
375,事故件數比例低於人口比例
375,死亡比例略低於人口比例
375,歲以上騎機車
375,死亡人數占整體倒是遠高於人口比例
375,老人反應能力下降
375,同時也有開車龜速
375,不開遠程等狀況
375,慢慢開只開熟悉的路就降低危險
375,最後統計數字上
375,歲以上開車與整體相比並沒有特別危險
375,不管年紀，開車上路就要為自己也為其他人負責
376,備註請放最後面違者新聞文章刪除
376,媒體來源
376,記者署名
376,曾健銘
376,完整新聞標題
376,模範父親駕車暴衝釀死傷
376,交通局會勘曝他有大違規
376,完整新聞內文
376,新北市三峽區北大國小前昨日發生嚴重事故，曾榮獲模範父親的歲余姓老翁，不明原因駕車衝撞機車以及剛放學的學童，造成死輕重傷的慘劇
376,交通局今日會同相關單位重返現場會勘，副局長林麗珠指出，初步研判肇事駕駛有超速闖紅燈禁止進入時段進入等項違規，針對交通介面部分也將會盡快提升整體安全性
376,本起事故發生於昨日下午時許，當時正值國中小下課時間，輛闖入禁止下課時間禁止行駛路段，不僅超速還闖紅燈，撞上機車騎士以及多名走在斑馬線的學童，駕駛肇事後未停下，繼續行駛又擦撞名學童，最後自撞護欄才停下
376,事故造成人受傷，其中名學童名婦人因傷勢嚴重，現場已無呼吸心跳，緊急送醫後仍有人不治，其餘人仍在醫院治療觀察中
376,警方事後調查排除酒駕肇事，據余姓駕駛友人透露，他疑似行駛途中身體不適才釀禍，但也有網友爆料，指出余翁在案發前個路口已肇事逃逸，因此不排除因為緊張才釀禍
376,今日上午時許，新北市交通局新北市警察局交通大隊以及當地里長重返事故現場會勘，副局長林麗珠表示，初步研判肇事駕駛有多項違規，除了駕駛人行為之外，針對交通介面來看，案發路段的標線號誌等相當完整
376,林麗珠也表示，事發地點附近為學區，後續考量通學巷部分，將會以學童安全為優先考量，後續將會研議是否設置減速設施，包括科技執法實體護欄等，來確保行人安全，或是以實體人行道方式補強改善
376,林麗珠也強調，後續調整以及加強部分會即刻辦理，研議的部分仍要考量各層面用路人的習慣及便利性，作業時間需要半個月至個月，將會盡早提升安全性
376,至於警語以及警方派駐的部分會在個星期內完成
376,完整新聞連結或短網址不可用等轉載媒體
376,////
376,備註
377,是誰的樁腳有人說是里長的里長是無黨籍的最近兩屆都沒有對手
377,但是色彩從年那屆里長選舉應該可以知道比較偏哪邊啦嘻嘻
377,///
377,另外
377,///
377,最重要的證據是
377,///
377,吳琪銘辦公室主任林姿佑
377,那他平常跟我們出去旅遊向來不喝酒
377,，那他其實平常也很少
377,開車，他只是心臟有問題，在想是不是心肌梗塞問題，因為他家就住在附近，他應該是從
377,他們家出來走那個方向
377,國民黨的樁腳會跟民進黨的立委出去旅遊根本想像不到吧
377,那怪黨媒直要幫這老人洗地又是模範父親又是心臟有病
377,里長跟立委辦公室主任都出來幫忙講話看來這位老先生應該真的是有力人士
377,還被叫環保英雄快笑死
377,///
378,大家好，我是城武，人稱法學達人
378,三峽老翁，因為個人恩怨
378,追殺女騎士
378,途中殺死多個無辜路人
378,為達目的，連無辜路人的生命也視若無物
378,這比級謀殺罪更嚴重
378,在法理分明的美國，應該會判到幾個死刑
378,有鄉民知道嗎
379,如果今天是撞到天母那些權貴在唸的學校會怎樣
379,是不是會突然修法過堆之前過不了的法案
379,還是因為接送都是豪車反而沒有任何死傷
379,反正我相信三峽這件事那個開車撞人的不會賠到什麼錢，立委也不會有所作為，畢竟般
379,人的命跟權貴還是差的遠
379,只能說有能力就趕快離開鬼島吧，嘻嘻
380,模範父母親的條件
380,沒有前科這個叫做素行良好
380,"家庭關係良好,子女有正當職業"
380,"有當里內志工會加分,或是什麼廟的幹部,鄰長之類的,對鄰里有貢獻的"
380,"因為是里長推薦的,所以""通常""會先找認識的"
380,"補充子女很優秀的,也是可能會加分"
380,條件就是這樣而已
380,每個里年就要出現個不是每個被找的都願意
380,其實里長都說不好找
381,媒體來源
381,新聞
381,記者署名
381,張柏源
381,完整新聞標題
381,網傳賴清德蕭美琴推薦順天堂海狗丸壯陽藥
381,查核中心詐騙
381,完整新聞內文
381,醫療類詐騙網站層出不窮，盜用名醫醫事組織與政治人物影像進行詐騙
381,近期臉書貼文
381,與廣告出現政治人物推薦可以解決男性問題的藥物，還假借順天堂與台灣泌尿科醫學會的
381,兩個臉書粉專，發布總統當選人賴清德副總統當選人蕭美琴支持順天堂研發的壯陽藥產
381,品圖片與連結，連結是頁式購物網頁，宣稱該產品可以解決男性問題
381,台灣事實查核中
381,心經查證後提醒民眾，此為詐騙訊息，勿輕信上當
381,近期臉書上出現賴清德拿著順天堂海狗丸及蕭美琴等人拿著順天堂海狗丸壯陽新紀
381,元廣告標語的可疑照片
381,對此，衛福部中藥司年月日發布訊息提到，社群平台
381,網路有關順天堂海狗丸產品訊息，並未取得衛福部中藥司中藥藥品許可證，且盜用竄
381,改圖片進行宣傳，涉違反藥事法相關規定
381,建議消費者若有相關健康問題，應循正規管道
381,找合格專業醫師診治，勿購買來路不明的商品做為預防或治療疾病之用
381,當前熱搜三峽死車禍肇事者為模範父親熱心公益里長懷疑是心臟疾病釀禍
381,順天堂藥廠股份有限公司官網年月日聲明表示，網傳產品冒用順天堂名號，順天堂
381,也沒有出產海狗丸
381,順天堂出品的丸劑類商品，依藥事法規定只能在實體藥房販售，網路
381,銷售號稱順天堂丸劑類商品，均是非法行為
381,台灣泌尿科醫學會臉書專頁月貼文澄清
381,，台灣泌尿科醫學會作為非營利組織，僅提供各項會議資訊醫學會資訊行政相關內容
381,等
381,若有其他內容如販售藥品廣告等，絕對為假冒
381,查核中心指出，傳言內容顯示賴清德蕭美琴的支持順天堂產品的圖片，經查均為圖
381,賴清德圖片經查是擷取自自由時報年月日報導，副總統賴清德當時在總統府
381,接見社團法人高雄市社福慈善總會成員，該組織贈送賴清德幅畫像的照片，被挪用圖
381,改成偽藥圖片
381,蕭美琴圖片經查是擷取自鏡週刊年月日報導，當時立委候選
381,人蔡培慧與時任副總統候選人蕭美琴同訪視南投基督教醫院，她們與醫院人員合照的紅
381,布條字樣遭圖竄改
381,查核中心續指，查核中心檢視真實的台灣泌尿科醫學會臉書粉專，在粉專專業資訊
381,透明度顯示成立時間是年，追蹤與按讚數均破千，目前並無刊登任何廣告
381,相較之
381,下，假冒的臉書粉專，成立時間是在年月，追蹤與按讚數均只有，且有刊登廣告
381,資安專家劉彥伯受訪強調，社群平台常出現盜用名人頭像名號詐騙的粉專，民眾可檢視
381,粉專的關於我和透明度，是否有出現按讚和追蹤人數少成立時間等不合理之處
381,劉彥伯進步說明，依照台灣法規規定，不能在網路販售藥品，該粉專宣稱賣藥，本身就
381,非常不合理
381,若點入網傳所附連結，可以看到顯示的網頁就是頁式詐騙樣式，網址是
381,連串無意義的亂數，且以誇大的廣告照片強調商品優勢，但對於商家資訊介紹相當有限
381,若該網頁有提供地址電話，民眾只要反查，可發現地址電話可能出現在不同的商
381,家不同商品，這就相當可疑
381,完整新聞連結或短網址不可用等轉載媒體
381,//////
381,備註
381,有上網買海狗丸的可以出來分享下功效嗎
382,ㄤㄤ
382,我看到車禍報導時想到，
382,如果當時的人迎面看到台車撞過來，
382,引發腎上腺素暴增思緒加速驚險的閃過了車子，
382,那麼這個差點被撞的人是不是就無法得到賠償呢
382,所以這個人是否會進入明明面臨了驚險車禍差點死掉，但只有自己沒辦法賠償的狀況
382,也就是說當時應該要想著既然閃掉會拿不到賠償那應該被撞下才可以
382,換另個說法，如果有個人揮拳，只要沒打到人是不是就不用賠償了
383,這次三峽的車禍
383,除了老年人口駕照制度有問題
383,還有他之前都出事了還讓他開車
383,肇事者感覺就不會賠
383,這次事件是否應該要國賠
383,上次八仙塵爆個人三百萬
383,這次都國中學生起碼過世的人五百萬吧
383,這次如果用國賠的形式大家可以接受嗎
384,///
384,十七個小時前
384,有脆的網友發文
384,說世壯運有中國選手人間蒸發
384,剛好就發生了三峽事件
384,然後聯想到日本福岡的汽車衝撞學生事件
384,覺得兩者有關連性
384,看完文章後我覺得
384,我以前是不太相信隨便摘器官這件事啦
384,但我看完後開始嚴重懷疑
384,台灣至少有萬多人
384,腦被摘了吧
384,不然怎會有萬多個讚啊
385,媒體來源聯合新聞網
385,記者署名李定宇
385,完整新聞標題三峽重大車禍學姊帶零食獻花祈福
385,被人渣撞死很難過
385,完整新聞內文
385,新北市三峽北大國小前昨天下午點發生重大車禍，造成張死的悲劇，今天早不少民
385,眾到案發現場獻花及致贈零食致意，三峽國中畢業的學姊表示，看到學妹被人家撞死心理
385,感覺非常難過
385,昨天名歲歲余姓老翁駕車經過北大國小前，高速闖紅燈衝撞機車及路過的學生，造成
385,人死亡，今天事發現場堆滿花束及零食
385,三峽國中畢業的學姊也前來致意，表示自己昨天上班的時候看到新聞，學妹竟被
385,人渣
385,撞死
385,心理相當的難過，因此今天特地前來向學妹祈福
385,完整新聞連結或短網址不可用等轉載媒體
385,//////
385,備註
385,現代年輕人真的很沒禮貌，教育失敗，竟然說個歲的模範父親是人渣
386,我覺得直戰顏色很智障
386,垃圾不只不分藍綠，也不分藍白綠
386,是垃圾就是垃圾，跟顏色無關
386,如果我沒記錯的話他老婆是前任里長
386,並且是代表國民黨參選新北市議員
386,///
386,我只想問里長，請問模範父親的標準到底是什麼
386,所以我說戰顏色很智障
387,媒體來源新聞雲
387,記者署名李育道
387,完整新聞標題三峽車禍死傷
387,男童衝回現場找媽媽那台黃黑機車惹淚崩
387,完整新聞內文
387,新北市三峽區北大國小外昨日下午下課時間發生起重大車禍，名歲余姓男子駕車銀色
387,轎車沿路闖紅燈高速衝撞，最終造成死傷悲劇
387,至於名死者身分，其中人是三峽國中
387,的女學生，人則是機車女騎士，原本準備接孩子下課，卻遭遇死劫
387,名清潔大隊人員也
387,透露，昨日在車禍現場等待警方鑑定時，位男童騎著腳踏車要衝過封鎖線，結果清潔隊員
387,問，才知道他是來找妹妹，還有騎著黑黃色機車的媽媽
387,據悉，現場黑黃色機車正是
387,這場車禍首當其衝的對象，婦人到院前已不治身亡
387,///
387,///
387,累了整天，卻怎麼都睡不著，久久無法平復清潔隊人員今日在上回憶，
387,起初收到通知時，以為只是小型車禍，帶著小包木屑就立刻前往準備做路面油漬清除作業
387,，但到現場才知道嚴重程度超乎他想像，他形容當下四處都是機車碎片，私人物品撒落
387,地，地上還有不少血漬
387,由於當時現場還未鑑定，他和組員只能在封鎖線外等待，這時位小弟弟騎著腳踏車想進封
387,鎖線內，本以為只是出於好奇想進去，因此他便上前阻止，這時弟弟回應我爸爸叫我來找
387,媽媽，然後接妹妹回家他反問你媽媽呢
387,，這時弟弟淡定地說的那台黃黑色摩托車
387,是我媽媽的讓他腦袋瞬間空白，不知道該說甚麼，且至今仍深深的刻在他的腦海裡
387,根據事故現場監視器與行車紀錄器畫面，可以看到當時余姓男子高速衝向路口時，首當其衝
387,的正是輛由女子駕駛的黑黃色機車，據悉被衝撞的女騎士開始身分不明，同時間
387,北大國小校長也到現場尋找位女性家長，最後經警方調查後確認，歲的女騎士是名媽
387,媽，原本準備前往北大國小，接孩子下課
387,悲痛消息令人感到無比心疼
387,完整新聞連結
387,///
387,"備註男童要找得媽媽就是那駕駛鎖定報復的對象之,唉"
387,///
388,媒體來源
388,記者署名
388,蔡秉宏
388,完整新聞標題
388,曾稱擺脫行人地獄賴談三峽車禍檢討
388,完整新聞內文
388,新北三峽日發生死傷的嚴重車禍，總統賴清德在演說上，特別強調要和地方政府
388,攜手協助家屬釐清案情，同時也會檢討改進，但賴清德在年就職演說上，就曾提到要
388,擺脫行人地獄，如今仍發生重大車禍，未來是否鎖定歲以上長者禁止開車
388,藍綠立委都
388,認為，還需要討論，而且也要有配套措施
388,聽到新北三峽重大車禍，總統賴清德日隨即探視傷者和家屬，蹲下身子緊握家屬的雙
388,手安撫情緒，就職週年談話也承諾會檢討改進
388,賴清德後續中央相關部會和地方政府，會攜手合作積極協助家屬，並盡速釐清事故發
388,生原因，檢討改進
388,但年前賴清德在就職演說中，就提到要打造符合人本的交通環境，擺脫行人地獄的
388,惡名，今年就出現嚴重傷亡事故
388,根據統計年，歲以上高齡者交通事故，就超過
388,萬件造成人以上，超過萬人受傷
388,現在傷者家屬請命，盼別讓歲以上長者開車
388,還路於民行人路權促進會陳法君台灣的交通是系統性問題，而不單單只是針對特定族
388,群，年前的取得駕照的老齡人口，其實是不用換發的，我們認為這個部分，可能還需
388,要做研議，可能去針對整體老年人口，去做個換照跟檢驗的動作
388,立法院江啟臣表達深切的慰問與哀悼之意，現在請大家起立，起默哀分鐘
388,為三峽重大車禍立院全體立委默哀分鐘，但眼下更重要的是如何修法保護用路人，同時
388,又兼顧高齡者駕駛權，藍綠立委皆認為強制歲以上長者不開車，需要更多社會共識和討
388,論，配套措施不能少
388,吳思瑤在歲刀切，這種方法，可能需要更細緻的研議，來予以個案的評估
388,陳玉珍那我們有什麼樣的配套，尤其在城市可能你可以用地鐵，那在鄉下地方的話，
388,沒有捷運的地方，是怎麼樣讓他們，也許是配合計程車司機，或是怎樣的做法，政府要整
388,套措施來做
388,社會盼嚴格修法保護用路人生命安全，但鎖定高齡者駕駛恐怕還需更多討論
388,完整新聞連結或短網址
388,////
388,備註
389,死車禍肇事者熱心公益里長懷疑心臟疾病釀禍
389,新聞
389,張柏源綜合報導
389,發布
389,歲余姓老翁左年曾獲模範父親表揚，平時身體硬朗
389,新北三峽區龍恩里長黃家賢
389,中說，肇事者熱心公益，因有心臟病史，懷疑會不會是心臟疾病導致車禍
389,圖翻
389,攝黃家賢臉書
389,歲余姓老翁左年曾獲模範父親表揚，平時身體硬朗
389,新北三峽區龍恩里長黃家賢
389,中說，肇事者熱心公益，因有心臟病史，懷疑會不會是心臟疾病導致車禍
389,圖翻
389,攝黃家賢臉書
389,新北市三峽區國成路國成街口北大國小旁日下午點發生重大車禍，台自小客車
389,因不明原因衝撞多名路人，造成人受傷，另名學生名家長到院前傷重不治
389,肇事的
389,歲余姓駕駛送往亞東醫院，里長晚間到院慰問傷者時指稱，余姓男子為人正直和善，熱心公
389,益，還曾榮獲模範父親的殊榮
389,余姓男子日下午點左右駕車行經新北市三峽區北大國小旁，高速衝撞停等紅燈的機車及
389,放學人潮，導致死傷重大事故
389,警方指出，余姓男子持有駕照正常，抽血檢測確認酒精
389,值是零，車上也未發現違禁品，警方已找來余姓男子的家屬調查其身體狀況，釐清確切肇事
389,原因
389,話題延燒歲駕駛肇事釀死重大車禍沈政男鼓勵老人家繳回駕照而非換照
389,余姓男子住在三峽區龍恩里，龍恩里長黃家賢日晚日前往板橋亞東醫院受訪時提到，此案
389,檢調單位已經著手調查，肇事的余姓男子是龍恩里熱心服務的環保志工也曾當選模範父親
389,獲悉意外後，他相當震驚，不知道是否有身體或藥物的因素，因有心臟病史，懷疑會不會
389,是心臟疾病導致車禍
389,相信會在余姓男子意識清醒後，由檢調單位釐清
389,黃家賢說，里長的心願是希望傷者都能夠早日平安脫險，因為余姓男子夫妻的兒女都在國外
389,，故以關心里民的態度前往醫院探視
389,親友表示，余姓男子向來不喝酒，過著退休生活，
389,年曾獲模範父親表揚，平時身體硬朗
389,據了解，余姓男子日中午跟妻子聯繫告知要從外
389,地回到北大特區的住家，沒想到下午在北大國小附近肇事闖下大禍
389,事件曝光後，名母親揭露，她在年月間曾推著嬰兒車走在國慶路的人行道上，名
389,駕駛卻突然開車衝上人行道，不僅撞到她和孩子，還撞壞社區的水泥花圃，當時她曾在發文
389,尋找好心幫助她的女護理人員，事隔年，她看到三峽這起重大車禍，經比對車牌號碼和駕
389,駛姓氏，發現余姓男子就是年前撞她的肇事者
389,該名母親呼籲，這可能不是單純的高齡開車問題，希望相關單位能進步了解肇事者的健康
389,狀況
389,新北警方向媒體證實，余姓男子與年人行道車禍案件的肇事者為同人
389,另有網
389,友在上分享影片可見，肇事車輛在事發前刻，途經前路口時擦撞分隔島，往後倒
389,退時，又擦撞後車，余姓男子沒停車查看，隨即加速離去，狂飆公尺後便發生嚴重事故
389,//////
389,原來如此鄉民差點又錯怪模範父親了
389,八又翻
390,你看那個老人就知道平常就是違停五年前還撞了媽媽推嬰兒車的
390,大大小小違規不斷就代表這個社會對於違法的人寬容
390,在日本駕照都不知道被吊銷多少次了
390,違法事情不斷執政當局還要縮限檢舉
390,當事人沒有再次次的違規學得教訓不懂得自我檢討
390,今天就發生連倒車撞到後車沒當場停下來
390,還直接加速衝撞機車女騎士跟學生
390,會發生這種惡性衝撞事件只是台灣人違法成性的縮影
390,不是很意外
390,台灣人就是違法成性三峽惡性衝撞只是這個社會的縮影其實沒啥好意外的對吧
391,如題啦
391,三峽老人開車暴衝撞死人撞傷數十人
391,請問依據台灣鬼島司法
