system_id,sentence
663,並全力配合釐清真相
663,對於部分網路帳號與社群名人散布不實連結影射政治背景，新北市府呼籲社會大眾勿信
663,謠勿傳謠，惡意扭曲事實的言論不僅對受害者造成二次傷害，也無助事件釐清
663,市府將
663,保留法律追訴權，嚴正遏止造謠歪風
663,//////
664,如題
664,三峽車禍撞死個女國中生
664,個中年女子大家都很不捨
664,很多人不認識也去現場送花
664,送零食送娃娃弔念
664,如果今天被撞飛層樓的是肥宅
664,社會也會為肥宅抱不平嗎
665,支持啦
665,不過我會在家裏用鍵盤支持
665,這樣才不會到現場找不到停車位要違停
665,當然也希望會到現場的，回家要買便當時不要違停接小孩不要違停在路上不要超速
665,行駛途中不要講電話用手機
665,不然說套做套誰都會
666,不是想唱衰這個聯盟
666,看下訴求
666,//////
666,駕駛人
666,全面
666,回訓要求全面定期回訓換照
666,改革高齡換照制要求除了體格與認知檢查，提出具有鑑別度的換照制度
666,交通工程改善
666,除了第三點有可行性以外
666,第二點基本上是很困難實施的
666,民眾黨立法委員吳春城日質詢交通部長陳世凱時指出，根據統計資料，
666,開車肇事率隨著
666,年齡增長而遞減
666,，法令卻限制高齡者壯世代的開車權利，他要求交通部在個月內提
666,出壯世代駕照政策檢討報告
666,統計報告就跟你說肇事率年齡增長而下降
666,你要憑什麼加嚴高齡換照制度
666,第點就更好笑了
666,看哪個有正常通勤的駕駛會支持
666,這個抗議感覺炒不起來啊
667,又又又又要還路於民啦
667,欸我怎麼說那麼多又呢
667,扯這麼多，敢不敢訴求重大違規律沒入車輛並銷毀啦
667,沒駕照又怎樣，記點又怎樣，車跟鑰匙都在我身上，我想開就開
668,媒體來源
668,記者署名
668,施怡妏
668,完整新聞標題
668,歲老翁急救中能找家屬賠償嗎
668,律師搖頭快做件事
668,完整新聞內文
668,新北市三峽區歲余姓男子日駕車暴衝，造成死傷事故，余男從車裡被救出時還有意
668,識，對醫護人員說了句不記得了，就陷入昏迷，目前在加護病房急救中
668,蘇家宏律師表
668,示，若歲老翁過世，只能就他名下的財產求償，不能跟他的兒女或太太名下的財產取償，
668,並建議家屬做件事
668,蘇家宏律師在臉書發文，受害人可依照法律程序先做件事情，如果歲老翁過世了，只能
668,針對其名下財產進行求償，不得要求配偶或子女連帶賠償，希望駕駛人能夠清醒，釐清事
668,故的原因，也坦然面對所發生的憾事，全力的賠償每位被害人或家屬
668,受害人可以先請求車輛強制責任險的給付
668,針對每個不同狀況的受害人，向歲的駕駛人求償
668,聲請假扣押，避免被告脫產
668,旦發生重大車禍，擔心被告脫產，應盡早聲請假扣押，鎖住肇事者名下的資產避免
668,資產被轉移脫產
668,提起刑事告訴，施以實質壓力
668,除了民事賠償，可同步提起刑事告訴，讓對方面臨坐牢等刑責上的心理壓力
668,透過法院進行調解
668,民事與刑事之外，也可走調解程序，有時更能促使對方家屬出面，從家族層面給予實質的賠
668,償與和解
668,，就陷入昏迷，目前在
668,加護病房急救中，未脫離險境
668,據了解，
668,，因
668,警方未發現可疑藥物或毒品，目前排除余男酒駕毒駕，詳細肇事原因仍待進步釐清
668,完整新聞連結或短網址不可用等轉載媒體
668,/////
668,備註
669,這個訴求我不太懂
669,其實交通這件事情，最需要抗議的對象就是人民
669,你去要求政府根本點用都沒有
669,因為政府知道他改了選票會掉，不然早就都改改了
669,你看當初第波限縮檢舉範圍，尤其是違停的部分
669,提案連署民代多數還繼續高票當選阿
669,也就是說，人民其實喜歡違停，人民覺得交通安全重要性遠遠不如方便
669,你在那邊抗議政府根本點用都沒有啊
669,台灣是民主體制，人民在意的議題才會變成改革的方向
669,你看大家都要抗中保台，大家都希望漲電價，這不就來了嗎
669,從頭到尾都沒人搞清楚這件事情
669,交通最大的亂源，就是民眾自己啊
669,中小學上下學時間
669,你去看看有多少並排停車的違停亂切車道的家長
669,身教都這樣了
669,你要怎麼希望台灣交通能改善呢
670,蹭
670,個故意殺人犯的行為，你們要還路愚民，
670,唯支持余文正死刑遊行，
670,再說次，
670,個故意殺人犯的行為，跟還路於民差遠了，
670,要嘛，殺人犯死刑，
670,要嘛，殺人犯死刑沒有第二種選擇
671,怎麼覺得又是搞那種三天交通大執法的東西
671,像是事故現場竟然開始普渡的感覺
671,不是
671,到底是誰可以決定該怎麼要求的
671,到底是
671,警察短期間內四處巡邏例如昨天十個員警在事故現場執法
671,討論祭出鞭刑絕對死刑給衝撞公眾的車駕駛
671,連坐法
671,禁止高齡老者開車
671,增設分隔島
671,規劃放學的走路區
671,用什麼還路於民的思考
671,感覺怪怪的
671,結果變成政府還是不敢為了選票冒犯四輪階級
671,或者是
671,抗議群眾為了自己行車方便
671,又彎曲變成不痛不癢的訴求
671,死兩個伸港小姐妹沒用
671,死三個三峽女學生沒用
671,死個東海會計系女學生沒用
671,問題到底出在哪裡
671,我們該怎麼做
671,政府是會去干涉你做正確的事的人欸
671,因為他們就是從過去到現在都不會做正確的事的單位
671,要想好
671,聰明的人專家幫幫忙
672,三峽事件予人足袂爽
672,毋過目前看起來
672,嘛毋知是啥人的問題
672,所以我袂去參加
672,等事件原因已經確定才講
672,而且若最後確定是駕駛個人的問題
672,按呢去抗議嘛無效
672,顛倒我講過幾若擺
672,天橋袂使拆
672,因為台灣城市人口密度真懸
672,需要閣較濟天橋來保護行人
672,莫講啥物人本交通
672,理想歸理想
672,愛面對現實
672,嘛莫講啥物天橋利用率低
672,癈話
672,閣有畫斑馬線人當然直接無欲行天橋矣
672,有天橋的所在本來就應該莫畫班馬線矣
672,親像這擺若有天橋通行
672,死傷嘛有機會減少
672,雙北市毋但袂使拆天橋
672,閣愛起天橋才著
672,這免去街頭抗議
672,這陣就會當做矣
672,三峽事件讓人很不爽
672,不過目前看起來
672,也不知道是誰的問題
672,所以我不會去參加
672,等事件原因已經確定再說
672,而且若最後確定是駕駛個人的問題
672,這樣去抗議也沒用
672,反而我說過好幾次
672,天橋不能拆
672,因為台灣城市人口密度很高
672,需要更多天橋來保護行人
672,不要說什麼人本交通
672,理想歸理想
672,要面對現實
672,也不要說什麼天橋利用率低
672,癈話
672,還有畫斑馬線人家當然直接不走天橋了
672,有天橋的地方本來就應該不要畫班馬線了
672,像這次如果有天橋可走
672,死傷也有機會減少
672,雙北市不但不可以拆天橋
672,還要蓋天橋才對
672,這不用去街頭抗議
672,現在就可以做了
673,三峽老翁遭起底曾任財務高管助人脫產常客
673,黑歷史曝光
673,新聞雲記者施怡妏綜合報導
673,新北市三峽區歲余姓男子日駕車暴衝，造成死傷事故，余男目前在加護病房急救中
673,，律師蘇家宏就建議，若擔心被告脫產，應盡早聲請假扣押，鎖住肇事者名下的資產
673,然而，有網友起底，老翁過去涉入多起勞務糾紛，有多次脫產脫罪的紀錄，並公開判決書
673,內容
673,有網友在發文，三峽余翁的豐功偉業，根據民國年的法院判決書顯示，余男
673,當時擔任某公司財務高管，因勞資糾紛案件遭到調查
673,最近期的案件為臺灣臺北地方法院
673,年度勞訴字第號民事判決，名員工向公司索討股票結清款時，法院最終判定該員
673,工敗訴
673,判決書寫道，原告離職時，被告持股委員會之代表人為余正，並非林蔚山，實難認原告
673,前揭函文中提及被告公司應辦理其股票之結清與給付之意思表示有送達被告持股委員會，是
673,原告此部分主張亦不足採
673,原解釋，白話文的意思就是我們已經把權責交給余翁，自然不用負責，法院採納被告
673,的說法，判決員工敗訴
673,原表示，從此案可以看出，余男明顯是幫人脫罪脫產的人頭，
673,既然他是幫人脫產脫罪的常客，那麼這次嚴重事故要從他那裡獲得賠償，我覺得是相當困難
673,原坦言，昨天晚上我翻完了所有名字叫余的判決書，真的有夠累的，其實早在日
673,就在調查，只是同名同姓的人太多，確定是大同余翁，才敢這篇的
673,另外也有網友在爆料，余某還曾經多次涉及剝削勞工退休金的案件，還疑似擔任
673,公司老闆白手套，但都能夠全身而退，他在剝削勞工方面也是慣犯了
673,底下網友熱論，難怪只能開台老破車比較想知道財產還有多少，趕快假扣押
673,原來是有背景的喔~難怪這麼敢財務主管，那應該很熟要怎樣脫產了就是都
673,處理好了就會放手搏這樣看來是要求償無門了嗎推爆料，準確性應該蠻高的
673,據了解，余男是大同公司英國分公司擔任高階主管退休，兒女都在國外，平時和太太起居
673,住
673,余男被救下車時還可正常溝通，對醫護人員說不記得了，但之後陷入昏迷，目前仍
673,在亞東醫院搶救中
673,經院方抽血檢驗後，已排除酒駕
673,至於確切肇事原因，恐怕得等余男甦
673,醒後才能釐清
673,/////
674,是否有專板
674,本板並非萬能問板
674,三則
674,本看板嚴格禁止政治問卦
674,未滿繁體中文字水桶個月
674,未滿繁體中文字水桶個月
674,未滿繁體中文字水桶個月，嚴重者以鬧板論
674,三峽歲老翁可能是覺得女騎士擋住他
674,他想要先轉無奈被擋這會讓路怒仔氣死需要追尾閃大燈按喇叭那種
674,然後轉彎撞到分隔島倒退撞到後車後車撞我幹麻
674,直接心態炸裂
674,然後猛踩油門只是想追上女騎士
674,追尾按喇叭閃大燈警告對方下
674,其實老翁因該是沒有殺心
674,有八卦嗎
674,只有我這樣覺得嗎
675,這種故意要銃康嗆聲政府的活動
675,大家千萬不要參加
675,名義上是為了交通
675,為了死者
675,但是實際上是想影響罷免你以為大家看不出來嗎
675,大家不要被這活動騙了
675,你抗議去新北市政府或交通部是可以
675,但你去行政院立法院就怪怪了喔
676,我覺得你列出的這些交通案例有的跟改革無關
676,就算是改了再多，要違規的還是會違規，除非你禁止他上路
676,但這是不可能的事
676,有人酒駕多次到駕照被取消，被關過，依然還是要酒駕
676,這次三峽的事故，現在有朝著是駕駛是肇事逃逸的方向
676,跟交通改革無關
676,康橋高中的案子，是駕駛吸毒駕駛，跟交通改革無關
676,花蓮早午餐店的事故，是闖紅燈，這也是駕駛的問題，跟道路規劃無關
676,三重逆向車禍，是疲勞駕駛，也跟道路規劃無關
676,這些案例中，老人駕駛也沒幾例
676,如果把這些通通都歸咎於交通部的責任
676,也是很莫名其妙
677,笑死原本還想問是不是到時候又要有抗議了
677,結果還在的有在籌備了
677,但說真的有用嗎
677,永遠都是第審是最嚴重的
677,然後呢後面就越來越輕
677,每次就抗議那下
677,人家才不鳥你
678,老翁還沒醒真相是怎樣目前也無從得知
678,但確實這幾天有不少搭配路口監視器的推測
678,認為老翁就是為了追殺那個女騎士才這樣亂撞
678,啊如果這件事是真的
678,那整件事跟還路於民還有啥關係
678,罰則提多高人行道畫多寬不是都沒用嗎
678,就是有個神經病會衝上來撞人
678,那到底要抗議什麼東西要修正什麼規定
679,失智列車要開了
679,連活動訴求是幹嘛的都講不清楚
679,如果是要老人換照
679,現在則就實行歲以上每年換照
679,如果是要行人零死亡
679,那不好意思，不可能
679,風險管理中這種事情就是降至定等級以下就是可接受
679,但絕不可能是零
679,再說道路安全的另外半是行車安全
679,無限上綱行人安全，卻把責任都丟給駕駛
679,行人過馬路連看都不看下
679,懶洋洋卡馬路
679,要絕對安全行人就是去走天橋
679,可是每次講到天橋交通改革仔就開始裝殘障
679,這種火車頭現在要辦活動
679,你們還是全部撞死好了
679,阿門
680,三峽老害撞死堆人
680,很多人自發去現場放祭品悼念
680,時間蔚為風潮連網紅都到現場直播
680,這種不是真心在乎的跟風行為
680,跟溪邊放生海魚很像呢
680,反正我有做好事就是正義
680,至於有沒有效我不管
680,你們就是要誇讚我做了好事
680,這種心態的人會不會是潛在的老害
680,五樓在被灌完泡芙後喜歡被摸頭誇讚
681,如題
681,我看三峽事件發生
681,大家就狂買零食去地上放
681,這次我看是太晚了
681,是不是以後重大車禍都會推升零食概念股
681,還是要死小孩才會
681,有沒有八卦
682,司法覺得不公道定程度大家都
682,累積了定的怨恨
682,什麼都沒有只有點錢
682,聽說某個組織專門為了給那些壞人該有的懲罰
682,因為國家司法單位根本做不到滿足正義
682,例如那個花蓮秀林國中女老師
682,那麼善良的人為了奉獻
682,卻被姦殺
682,留下個癌症了的老母
682,結果政府只能把他抓起來關關
682,古代就是把人犯殺人償命砍頭
682,新加坡也有讓罪犯痛苦不堪的鞭刑
682,臺灣不管是子女被人
682,隨便撞死
682,推下墜樓
682,勒死
682,刺死
682,註三峽行兇追撞
682,註五億高中生
682,註花蓮秀林女老師案
682,註鉛球運動員刺死分手女高中生案
682,全部都只能輕描淡寫
682,第先全力保護兇手生命
682,第二就是限制人身自由幾年
682,有的甚至還無法判自由刑定罪
682,古早日據時代有廖添丁義賊
682,今怎麼沒有臺灣家屬的復仇者聯盟
682,聽說以前有些案件還會有黑道仗義衝警局打人的，現在怎麼都沒有了呢
683,記者盧品皓
683,高雄名李姓男子，日下午三點多，駕駛休旅車行經鳳山五甲三路，沒有注意路況，直
683,接撞飛過馬路的康姓男子，導致對方頭部撕裂傷身亡，肇事駕駛稱被柱擋到，沒有看見
683,行人，而警方將持續釐清肇責
683,輛白色休旅車直行，但前方有名身穿黑衣的男子準備過馬路，沒想到，下秒出事了
683,目擊民眾天啊
683,男子直接被撞飛，空中翻轉了整整圈後，頭部重摔在地，當場沒了呼吸心跳，救護車獲
683,報趕到現場，緊急將人送醫，但到院前男子已經身亡，而撞擊當下發出的巨大聲響，也讓
683,附近店家嚇壞了
683,目擊店家康男他要過馬路，那部車開過來就撞到了，噴過去，噴去的時候阿伯就在
683,這裡了，已經直在出血了，用飛的用噴的，噴來這裡，從那邊噴來這邊，我看到的時候
683,他就像球樣，倒過來躺在地上就不動了
683,目擊民眾聲音有沒有很大聲，很大聲
683,回到事發現場，死者的鞋子與帽子還留在路旁，而這起死亡車禍發生在日下午點多，
683,高雄鳳山區五甲三路處路口，歲李姓男子駕駛休旅車，向警方稱真的沒看見行人，可
683,能被柱擋住了，沒有注意路況的他，造成步行的歲康姓男子頭部撕裂傷身亡
683,交通分隊長賴益靖初步肇事原因研判，為駕駛未注意車前狀況，詳細肇事原因仍需交
683,大判定
683,由於康姓男子有沒有依規定走在斑馬線上，警方將持續調查，才能釐清方肇責，只不過
683,剛出門就遇上死劫，恐怕讓家屬無法接受
683,////
684,三峽車禍女童持續恢復中曾向醫護人員喊想回去上課
684,記者蕭沁梅曾健銘施協源報導
684,新北市三峽區日發生起重大車禍，名歲的余姓老翁下午時許因不明原因突然駕
684,駛小客車於國光街與國成街口北大國小前暴衝，事故目前已釀死傷，而肇事的余
684,翁及名女童目前仍在亞東醫院治療中
684,據了解，其中名女童目前已清醒且持續恢復中
684,，並曾向醫護人員透露想回去上課
684,三峽重大車禍釀死傷，由於當時正值放學時段，因此傷者大多為學童
684,其中，肇事的
684,余姓駕駛及名女童目前仍在亞東醫院救治中
684,據了解，其中名女童目前已清醒且能夠
684,看手機，還曾向醫護人員透露想回去上課，院方也指出，名女童目前病況穩定，持
684,續恢復中，醫院將持續治療及對家屬提供身心支持
684,回顧案情，日下午點分，名歲的余姓老翁駕駛小客車由學成路進入國成街，行
684,經國光街，再由復興路巷往復興路方向行駛時，因不明原因暴衝擦撞輛機車輛自
684,行車及多名行人
684,由於案發地點位在北大國小前，當時正值放學時段，警方獲報到場時，
684,共發現名傷者，其中有人，經緊急送醫後名女騎士及名三峽國中的女學生於當
684,晚宣告不治
684,////
684,反觀
684,男孩淚國家亂七八糟念書有什麼用
685,每天看新聞台報導各種犯罪事件交通事故
685,其中不乏蓄意殺人過失殺人酒駕毒駕肇事
685,原本的司法刑罰本來就不高
685,經過法院判定有的都判很輕或是減刑
685,不然就是入獄之後還可以假釋
685,為什麼台灣都沒有考慮使用嚴刑峻法
686,三峽校長稱死者只是普通學生何意
686,為何要用只是普通來形容學生
686,有人能閱讀出當中的空氣嗎
687,這樣好了
687,抗議完後，
687,情緒發洩完，
687,政府做個樣子，
687,就船過水無痕，
687,什麼事都忘了
687,那
687,次
687,不
687,是
687,這
687,樣
687,無照能不能開車
687,體檢沒過能不能開車
687,腦袋有洞能不能開車
687,理論上不行，
687,因為法律規定不行
687,但那只是法律說不行
688,今天的重點是在肇事逃逸
688,他都已經知道自己撞到別人的車了
688,他就應該馬上車子停下來
688,結果
688,大家只因為後面車禍很嚴重
688,沒有去追說為什麼他都已經肇事
688,還可以繼續開
688,那這樣子造成的狀況
688,就是反正以後就先跑再講
688,肇事逃逸的刑責又不高
688,不管撞到什麼
688,我都先回家
688,現在是很多酒駕的
688,第時間被發現
688,就回家
688,我不知道
688,肇事逃逸的這個刑責要先把它提高
688,保留人證物證
688,也保護所有人
688,才不會有後續這麼多遺憾的事情發生
689,該不會脆上那些青鳥說的是真的
689,他是接受恐攻任務的殺手
689,繞路或許是為了探出能造成最多傷亡的路段
689,以及等待能造成最多傷亡的時間到來
689,雖然我還是不懂大罷免就能阻止恐攻的關聯在哪裡
689,但至少關於接受命令實施恐攻這點
689,脆上那些青鳥是講對了~
690,支持啦，哪次不支持
690,抗議抗議抗議
690,行政院怠惰不管事
690,立法院怠惰不修法
690,兩黨樣爛
690,抗議抗議抗議
690,不要問我要怎麼改怎麼修法才滿意
690,我要是知道交通部長就給我當
690,我要是知道立法委員就給我當
690,人民最大的權力就是抗議
690,抗議抗議抗議
691,衝撞死真相陷謎團
691,三峽翁行車紀錄器還原傳出陣陣音樂聲
691,記者陸運陞黃資真新北報導
691,新北市三峽區日名歲余姓男子駕車暴衝，導致人死亡人受傷，目前余男依舊意識不清，無法筆錄，網傳余男可能有路怒症釀禍，但根據行車紀錄器內的畫面，警方發現全程僅有音樂聲，余男本人並沒有說話，顯現情緒平穩
691,初步了解，余男當天正從苗栗開車北返回三峽，下交流道後卻未依照固定行程返家，而是先繞了分鐘的路後，在處公園稍作休息，再開車上路
691,而網傳余男可能有路怒症，才會直直往女騎士方向衝撞，引發連串車禍，但警方從車內的行車紀錄器畫面發現，背景僅有音樂聲，余男沒有發出任何聲音，若真的有煩躁情形，應該會有類似言語，可見並無路怒症說
691,目前余男只有短暫睜開眼睛，無法言語，因此無法進行筆錄，切要待與檢方醫院協調後才能開始，警方也有小時戒護，更無市長前往探視事
691,全案調查方向以釐清余男當天行程為主，仍不清楚是人為或是機械問題
691,/////
691,_
691,等待
692,哇塞，說要上街抗議
692,下午馬上發文量暴增
692,堆人在為腳痛部護航
692,用各種奇怪的邏輯說抗議沒有用耶
692,現主時是飼料到帳了嗎
692,堆青鳥飛出來了
692,吱吱吱，飼料真好吃
692,免費的飯真香
693,事情發生兩天了
693,看整個網路直砲轟
693,開始大家狂砲駕駛年紀大導致暴衝
693,結果群人跟風要把高齡駕駛給禁掉
693,但是看到事發前的影片
693,又發現駕駛早就跟人發生車禍
693,後續就是路怒症爆發
693,現在又開始狂砲路怒症
693,所以主因到底是什麼
693,還是只要主因不是我也有
693,這些人的駕照全部都禁禁
694,這也蠻奇怪的
694,他開始撞到安全島
694,倒退撞到後車
694,他都沒有表示驚訝或是緊張
694,中途擦撞到騎車的人沒表示驚訝
694,最後撞到機車還有學生
694,都沒有驚訝或是害怕
694,就心平氣和地撞下去
694,哇
694,這比較可怕吧
695,怎麼沒把酒駕放進去
695,最近酒駕新聞也是大新聞
695,以下取自新聞
695,/高雄市凌晨才發生酒駕奪走命，今凌晨有有名男子酒駕在大順
695,路撞倒名騎機車婦人，拖行到公尺後才停下，婦人當場沒有呼吸心跳，雖然熱心民眾
695,幫忙還是回天乏術
695,高雄市天內已發生起酒駕撞死人的意外
695,酒駕不定時炸彈
695,酒駕致死等同無差別殺人案~~~~~~~~~~
696,自由
696,三峽車禍肇事車內發現粉圓警排除邊開車邊進食
696,//
696,記者徐聖倫新北報導新北市三峽死車禍
696,不過警方表示，行車紀錄器
696,，初步排除邊開車邊吃而分心肇事的
696,可能，不排除肇事駕駛余文正
696,，才會在下交流道後，刻意停在
696,學成路的公園附近
696,肇事車內被發現有碗粉圓，除車內地板散落地粉圓，紙碗還留在車內
696,據悉，歲肇
696,事駕駛余文正從苗栗北返後，沒有第時間回家，來到學成路某公園附近停留，車子閃雙
696,黃燈停在公園邊，但監視器拍不到人影，僅有車尾，無法判斷他當時到底有沒有下車，也
696,無法判斷那碗粉圓到底何時在車上的
696,而該公園附近確實有賣冰品的店家，加上近日天氣漸熱，
696,警方唯確定的是，各種跡象看來，余翁沒有邊開
696,車邊進食，可從肇事原因排除
696,//////
697,這個題目有點藍色窗簾
697,就像是作者在文中寫上
697,這是個藍色的窗簾
697,國文老師會說
697,作者藉由對於窗簾的描寫
697,闡述他心中巨大的憂鬱
697,導致他無法再繼續忍受這樣的生活
697,作者想表達的
697,這他媽是面藍色的窗簾
698,新聞直報導三峽車禍事件害我感到恐懼都不太敢買車了，
698,可是沒有屬於自己的車都直搭高鐵台鐵公車捷運感覺很不方便
698,畢竟不能來場隨時說走就走的旅行
698,我想請問大家，
698,不買車只搭高鐵台鐵捷運公車會很痛苦吧
698,看到朋友買雙載女友出遊自己卻只能搭捷運或公車會很漏氣嗎
698,生中都沒有買車來開是不是魯蛇呢
698,有沒有八卦呢
699,糖果餅乾曬整天
699,又有人鼓噪要送弱勢
699,不是欸
699,那些食物並不是放在陰涼處
699,而是放置在初夏的烈日下
699,現在是你可以不吃
699,但定要請你朋友吃的概念嗎
699,如果有人吃了三峽的貢品導致上吐下瀉要找誰負責
699,很純粹的悼念
699,怎麼往奇怪的地方發展
700,各位朋友們晚上好呀
700,本肥鍵盤小五郎
700,本肥來看新聞推論下
700,昨天看新聞時有訪問到目擊者
700,目擊者說肇事老頭在最後撞上分隔島打開車門時是清醒的
700,現在新聞又說車內只有音樂聲表示情緒平穩
700,所以本肥可以推論肇事老頭是在意識清醒情緒平穩的狀況下進行全程的衝撞嗎
700,如果真的是這樣
700,這心理素質可說堪比職業殺手
700,衝撞殺人全程情緒波瀾不驚
700,這樣的謀殺罪可以判死刑了吧
701,我都不知道警察除了維護治安和抓壞人以外
701,還有心理輔導和精神狀態判定的專業
701,我看以後不需要輔導師和情緒諮商
701,找警察就好啦
701,幹你娘
701,智障
702,欸不是阿，般要是踩錯油門或機械故障不會不發語心情平靜才對啊，怎麼警方的說
702,法跟我們老百姓的經驗不大相同阿
702,所以反過來說，應該是初步可以排除踩錯油門或機械故障原因比較合理吧
702,大家評評理
702,舊
702,是
702,內
702,調
703,最喜歡宋雨琦
703,三峽歲女童命喪輪下同學不捨齊送小卡
703,/////
703,記者邱中岳黃資真新北報導
