system_id,sentence
1,民視
1,快新聞基隆死亡車禍
1,歲少年無照雙載過彎撞分隔島釀死命危
1,即時中心潘柏廷報導
1,基隆市安樂區今日凌晨發生嚴重車禍事故
1,名歲賴姓少年無照騎車，並載著歲
1,黃姓友人
1,行經基金路號附近時，
1,疑似車速過快，過彎時突然失控直接向左偏移，直撞
1,上中央分隔島
1,警消獲報後，發現
1,賴姓少年已經無呼吸心跳，緊急送醫後搶救不治，至於另
1,位黃姓男子則意識不清
1,，仍在醫院搶救當中
1,警方指出，今日上午時許獲報，於安樂區基金路發生起普重機車自撞交通事故，為
1,名歲賴姓男子騎乘普重機車附載歲黃姓男子自撞分隔島
1,現場由消防隊緊急搶救，然而賴姓駕駛經送醫後宣告不治，黃姓男子仍在醫院搶救中
1,警方
1,說明，駕駛經實施抽血酒精濃度檢測，確認無酒駕情事，案發後由交通警察隊依規定到場測
1,繪，以釐清詳細肇事責任
1,警方呼籲，切勿無照駕駛，行車時務必遵守交通規則，減速慢行，以維護用路安全
1,/////
1,下次不敢了
2,每次看到這新聞我反而不會關注在無照，而是駕駛習慣這種駕駛習慣有駕照也是很糟糕
2,看起來像右轉彎太快直接外拋撞上去
2,講真的台灣堆人都不會正確轉彎，因為考照根本沒考，都是靠本能經驗去學習
2,技術不好情況你就乖乖的過去就好，技術好也不要超過
2,這種撞爆的感覺就超過，而且撞上前也沒立即減速，正常急煞之後重壓前煞定
2,會外拋，但撞擊力道可以減到最輕頂多就摔車運氣好擦挫傷，運氣不好車子壓斷你
2,的骨頭，更糟糕情況就是被學長收掉
2,建議拉如果沒有長時間在家裡附近練習的就慢慢騎到可以練習的場地熟悉轉彎煞車
2,因為他的車主手冊教的比考照詳細，考照根本沒教你怎麼正確轉彎，更不用說左轉了
2,左轉講都沒講
3,快訊三峽北大國小旁車輛暴衝
3,釀多人傷其中人無呼吸心跳
3,記者陳以昇戴若涵新北報導
3,新北市三峽區國光街國成街口北大國小旁日下午時分，發生起嚴重事故
3,部轎車因不明原因暴衝，衝撞多人，其中人當場失去呼吸心跳
3,警消獲報到場，趕緊將
3,人送醫搶救，至於肇事車輛則路行駛到復興路才自撞停下，至於詳細事故發生原因及經過
3,，仍有待進步調查釐清
3,///
4,安安，各位安安，買不起房子的魯蛇安安
4,事情是這樣子的喇
4,那邊我熟，現在這時間就是堆國小幼稚園家長接小孩的時間
4,包含三峽國中都會走這個路口回北大，理論上那時候路口都是學生
4,從國光國成路口衝到復興路
5,媒體來源
5,中時
5,記者署名
5,黃仲瑜
5,完整新聞標題
5,快訊三峽北大國小車輛暴衝家長學生多人倒地命危
5,完整新聞內文
5,新北市三峽區國光街與國成街口，發生車輛疑似暴衝事件，現場多位民眾遭受撞擊，消防
5,局獲報立即派遣多輛救護車到場，初步估算有多名傷者，其中有人當場無呼吸脈搏，
5,而暴衝車輛，行駛到復興路上才自撞受困，目前傷者還在陸續送醫中，現場交通相當混亂
5,，請民眾提早繞路，勿靠近圍觀，詳細車禍原因還有待警方釐清中
5,據了解現場在三峽區北大國小旁，詳細車禍狀況還在釐清中
5,根據民眾描述，車禍地點在國小旁路口，當時正是放學時間，現場都是家長跟下課的學生
5,，當時車輛快速撞擊，導致家長跟學生噴飛倒地，很多人當場倒地血流如注，其他家長見
5,狀立即上前，有家長跟學生當場無呼吸脈搏，多人在路旁直接急救，畫面相當混亂，
5,目前得知傷者都已經送醫，總人數還在統計中
5,完整新聞連結或短網址不可用等轉載媒體
5,///
5,備註
5,///
5,_
5,/
6,台灣人看到國外類似事情發生，
6,往往都群在那嘲笑戲謔，
6,要多沒口德就多沒口德，
6,發生在自己身邊才知道痛
6,起碼國外會重判啦
6,反觀假裝很悲憤
6,卻仍要挺惡挺輕刑的台灣人
6,在這種挺輕刑的社會氛圍下
6,認真說
6,過失大概年以下實際關年個月吧
6,故意年實際關年
6,然後全國性的輕刑法律問題
6,刑法失去嚇阻力
6,就整天在那市長負責里長負責的
6,台灣真的活該
7,快訊三峽北大國小旁重大車禍命危歲駕駛臉部擦傷送醫
7,/////
7,▲三峽重大事故，歲駕駛因不明原因駕車暴衝，造成人輕重傷，其中人命危
7,圖
7,民眾提供
7,記者陳以昇莊智勝新北報導
7,新北市三峽區國光街國成街口北大國小旁日下午時分放學時間傳出重大車禍
7,，初步了解，現場輛自小客行經該路段時，突因不明原因失控暴衝，衝撞多名路人，現
7,場共人輕重傷，其中人傷勢嚴重，當使失去呼吸心跳，現場民眾立即協助
7,據調查
7,，肇事的駕駛是名歲男性，因撞擊當下安全氣囊爆開，因此僅臉部擦挫傷，目前送往
7,醫院治療，詳細肇事原因尚待進步釐清
7,/////
7,/////
7,/////
8,各位對於這種事情應該也見怪不怪了吧畢竟這裡是鬼島
8,而且就算真的有人過世我們過失致死最重也才年
8,想想你家人你朋友甚至你自己被撞到死或是半身不遂
8,對方脫產然後關年偉栽鬼島司法
9,如題啦
9,台灣鄉民時常說
9,歐洲美國若有恐怖攻擊
9,都會說是阿拉花瓜
9,結果
9,花蓮早餐店被整台車撞進去
9,新北三峽汽車暴衝撞人
9,嚇死人了
9,相關單位在幹嘛
9,社會安全網呢
9,有沒有卦
10,緊
10,經
10,沒事沒事
10,只是撞死人而已，又不是高官跟法律人，絕對不會判死刑啦，七十五歲是能判幾年徒刑，
10,要錢沒有反正以後領現金就好
10,還好這是在台灣，要是這是在中國就死刑了，謝謝黨的德政
11,//星期
11,上報
11,新北車輛暴衝撞國小學生名學童失去呼吸心跳
11,上報快訊呂品逸年月日
11,警消獲報三峽地區發生重大車禍造成多人受傷人失去呼吸心跳，目前正趕往現場
11,合
11,成照片翻攝畫面
11,新北市三峽今天日下午發生重大車禍，疑有輛自小客車在北大國小附近的國成路
11,國光街口突然暴衝，直接衝進群國小學童中，其中名學童當場失去生命跡象，現場民眾
11,見狀，在等待救護車之前，緊急就地幫學童做，警消目前已趕到現場，將傷者緊急送醫
11,據了解，開車的駕駛為輕傷，至於肇事情形仍待警方調查
11,///_
11,社會安全網又破了
12,年在秋葉原有人開車無差別撞人
12,最後釀成七死十傷的悲劇
12,兇手也在前陣子被處死了
12,三峽這次的開車撞人也會是當年秋葉原的翻版嗎
12,剛剛看新聞以及七個沒呼吸心跳
13,貧富越不均的
13,就越容易有這種事
13,有錢人繳的不是稅
13,是保護費
13,但是保護費有沒有效
13,那看私校就知道
13,不然台中為什麼私校那麼呱張
13,反正新北ㄛ
13,上次清水乾哥什麼ㄉ
13,就知道也沒救ㄌ
13,警察市長嘻嘻
14,剛剛看完三峽車禍影片
14,太誇張了完全沒減速路撞到底
14,機車行人都被撞飛
14,那車速是要趕去投胎嗎
14,不知道各位怎麼看
15,年撞死三千人，對社會危害如此重大
15,但台灣人覺得
15,撞死再多人觀感觀感永遠比紅牌重機好
15,全世界哪比得上台灣人的價值邏輯
15,交通爛成這樣全推給人民素質
15,永遠沒有任何官員需要負責
15,厲害了花果山群猴福地
16,青鳥定是中共製造的恐慌
16,我們定要小心
16,相信呆丸人的駕駛技術跟道德
16,所以定要站出來大罷免
16,這樣這類事件就會減少
16,如果讓藍白立委再這樣惡搞下去
16,這樣的事件只會層出不窮
16,各位定站出來支持大罷免
16,才能有效降低事故發生
16,這樣我可以外派出國玩嗎
17,三峽歲男子開車暴衝放學人潮傷人送醫
17,所以大家不要再問歲了，
17,其實是歲
18,今天如果換成個未成年的小學生
18,殺死這麼多人
18,你們是樣的態度嗎
18,你們為甚麼要對老人這麼壞
18,小孩拿到槍還是武器還是弄錯東西
18,也會害死很多人啊
18,你們換個角度想阿
18,錯不再東西
18,錯使用的人啊
18,大家覺得呢
19,對老人可以開車上路這點感覺到很奇怪
19,這些老人家身體機能都已經退化了
19,你卻讓他還可以開著車上路
19,這樣不就跟八點檔樣玩碰碰車了
19,而且這些老人年紀都已經那麼大了
19,法律對他也沒什麼用
19,口氣撞死好幾個，也拿他沒辦法啊
20,台灣各種交通亂象酒駕毒駕未曾改善
20,政府還帶頭修法，放寬違停等微罪不罰
20,之前同事被車撞到骨折還打鋼釘要復健
20,還慶幸說還好是被撞到
20,當下就有保險公司處理，後續開了各種賠償項目給對方
20,像三峽的國小車禍這個跨爪
20,寶貴的年輕生命走了
20,受害者跟家屬大概也求償無門
20,老人沒在工作賺錢，兩手攤也不怕被關
20,真的被關了，他的兒女還省筆請看護或療養院的錢
20,在台灣已經不是交通安全的問題了
20,甚至被車撞了是不是也要賭運氣
21,三峽歲翁駕車國小前暴衝傷命危女到院前已
21,壹蘋新聞網
21,//壹蘋新聞網/黃泓哲綜合報導
21,記者黃泓哲台北報導新北市三峽區今午後時發生起嚴重車禍，名歲老翁駕
21,駛的車輛疑似突然暴衝，直衝國光街與國成街口人行道，造成現場民眾四散奔逃，多人被
21,撞倒
21,消防局接獲報案後立刻派出多輛救護車趕往現場，初步估計共人受傷，其中人
21,當場失去呼吸心跳，包括名年僅歲與歲的女學生，及名歲的女性家長
21,肇事車
21,輛最終撞上中央分隔島才停下，駕駛本人也度昏迷，連同傷者共有人送往恩主公醫院
21,急救
21,恩主公醫院指出，目前共有名傷者送至院內，其中名女性到院前已，情況危急
21,另
21,有名女性骨折名女性與名男性身上有擦傷，院方正全力搶救中
21,/////
22,今天開車都能撞學童
22,重機速度更快
22,而且重機騎士都是魯蛇
22,貸款都沒錢繳更沒錢賠
22,你認為重機這樣能上國道
22,錢賠得出來嗎
23,乳提我尼歐
23,剛剛在上面查了下三峽
23,就看到影片了
23,那個根本沒剎車直接衝撞行人
23,騎機車的安全帽還被噴到空中在掉下來
23,這太血腥了
23,到底這種意外要怎麼預防阿
23,是否有專板
23,本板並非萬能問板
23,三則
23,本看板嚴格禁止政治問卦
23,未滿繁體中文字水桶個月
23,未滿繁體中文字水桶個月
23,未滿繁體中文字水桶個月，嚴重者以鬧板論
24,快訊三峽恐怖撞擊瞬間曝光
24,失控轎車闖紅燈高速衝撞米
24,新聞雲
24,記者陳以昇黃彥傑莊智勝新北報導
24,新北市三峽區國光街國成街口北大國小旁日下午時分放學時間傳出重大車禍
24,，造成人輕重傷，其中人失去呼吸心跳
24,現場行車紀錄器拍下，當時許多學生放學走
24,出校門，熙熙攘攘走斑馬線過馬路，未料輛自小客車闖越紅燈筆直高速撞上，在路口
24,停等紅燈的機車過馬路的學童當場被撞飛，由於事發太過突然，現場目擊民眾嚇傻，
24,度愣在原地數秒才反應過來
24,初步了解，該輛肇事的小客車衝撞約公尺，直到撞上中央分隔島後才停下
24,警方調查
24,，肇事駕駛高齡歲，撞擊後陷入昏迷，目前緊急送醫，詳細肇事原因仍待進步調查釐
24,清
24,/////
25,媒體來源民視
25,記者署名張瑋珊報導
25,完整新聞標題三峽重大車禍歲駕駛昏迷急救
25,學童躺地緊急畫面曝
25,完整新聞內文
25,新北市三峽區國成路國光街口，今日下午時分發生重大車禍，自小客車不明原
25,因衝撞多名路人，造成多名學童輕重傷，人當場失去生命跡象，分別送往恩主公醫院
25,土城長庚與板橋亞東醫院
25,初步了解，昏迷送醫急救的傷者為歲的轎車駕駛
25,如今現
25,場畫面曝光，只見畫面中滿地都是散落的書包及車殼碎片，多名受傷的學童躺在地上由救
25,護人員緊急進行，畫面相當怵目驚心
25,新北市三峽區國成路國光街口，今日下午發生起重大車禍，名歲的老翁駕駛
25,自小客車行經國光街國成街口北大國小旁時，車輛突然失控衝撞多名路人後，疑
25,似肇事逃逸，路衝到復興路撞分隔島才停下，造成人當場失去生命跡象，其中人送往
25,恩主公醫院，人送往土城長庚，人送往板橋亞東醫院
25,警消獲報後到場救治，其中多名傷者為國中小學童，從現場畫面可見，路上滿地都是學童
25,散落的書包課本等雜物，還有許多車殼碎片
25,多名受傷學童則躺在路中，由現場醫護人
25,員緊急進行救治，畫面相當怵目驚心
25,詳細事故發生原因及經過，仍有待進步調查
25,釐清
25,最新傷亡名單
25,男，，昏迷，送亞東
25,女，，，送恩主公
25,女，，清醒，送亞東
25,女，，送亞東
25,女，，，送恩主公
25,男，，送土城長庚
25,女，，土城長庚
25,女，，土城長庚
25,女，，，送亞東
25,女，，，土城長庚
25,女，，亞東
25,男，，昏迷，送恩主公
25,女，，土城長庚
25,女，，恩主公
25,女，，恩主公
25,男，，清醒，土城長庚
25,完整新聞連結
25,/////
25,備註
25,唉新北什麼時候能安居樂業
25,個新北孩童躺在地上
25,我豪難過
26,句話
26,台灣人自業自得
26,當有人在檢舉交通違規的時候
26,傾全國之力把這些人打成十惡不赦的檢舉達人
26,接著票全投給那些放寬交通違規的民代
26,問到交通先插測速賺錢
26,接著取消檢舉機制
26,再來放寬駕照條件
26,癲癇或高齡你想領就領
26,你覺得老人民代們會把法修回去砸自己的腳嗎
26,不會
26,台灣人就他媽自業自得
26,今天撞死這幾個有什麼用
26,撞到哪個達官貴人的小孩了嗎
26,上次都撞到康橋仔了有什麼改變嗎
26,沒有，
26,被撞死的小孩你只能怪你爸媽用四五十年
26,自己用民粹把台灣交通搞成這樣
27,幹
27,今天又看到新聞，個歲老人開車暴衝三峽
27,這種三寶到底要怎麼治
27,本肥想到個方法啦
27,強制高齡駕駛買高齡專用車險
27,但這些錢不白繳啦，政府拿去
27,補助駕訓班開高齡者反應特訓班教阿嬤怎麼分油門煞車後照鏡不是拿來補妝的
27,補助裝自動煞停或車道維持，沒裝的車不准上路，抓到就罰孫子孝親費加倍
27,路上高齡三寶大減，因為保費提高，阿公自己會算不如叫孫子載，省錢啦
27,這樣搞，馬路少堆移動神主牌，高齡者也能繼續開車只要他們夠有錢，兼二顧摸蜊
27,大家覺得這方法有搞頭嗎
27,還是直接沒收老人駕照比較快
27,我阿嬤說如果我發這篇文，她就要斷我網路
28,老實說近期也不是第次那麼嚴重的車禍了吧，
28,新聞大概熱三天，又回到大罷免，
28,交通部就是新聞稿會研議修法，然後沒下文，
28,然後可能最近幾天三峽酒測會抓嚴點，
28,政府發發臉書強烈表達遺憾，然後沒下文，
28,七條命就這樣死的不明不白，
28,兩手攤沒錢，要關也關不了幾年
29,///
29,///
29,///
29,///
29,///
29,///
29,男，，昏迷，送亞東
29,女，，，送恩主公
29,女，，清醒，送亞東
29,女，，送亞東
29,女，，，送恩主公
29,男，，送土城長庚
29,女，，土城長庚
29,女，，土城長庚
29,女，，，送亞東
29,女，，，土城長庚
29,女，，亞東
29,男，，昏迷，送恩主公
29,女，，土城長庚
29,女，，恩主公
29,女，，恩主公
29,男，，清醒，土城長庚
29,禱告傷者脫離危險，譴責駕駛
30,有人看到台灣發生車禍就會嘲諷說老人或女人開的檢討這些東西
30,然後過沒幾天又發生同樣的事循環而已那麼我就可以懷疑跟老人女人沒關係
30,而是有更深厚的原因才對也就是說只要看數據就會發現台灣交通事故率
30,就是比其他國家更高台灣人出國駕駛也比其他國家更容易出事代表台灣人本身
30,駕駛技術就有問題而就我在路上的經驗亂騎車開車的人確實是大堆常常看到
30,外賣的車禍跟客車起衝突不然就是亂超速亂變道的把馬路當家裡賽車場開樣
30,還有人講電話的我還親眼看過有人騎車要左轉結果他頭朝右閉眼睛在左轉的
30,不知道是在練啥特技嗎
30,所以我寧願搭捷運或公車至少還能補眠看手機因此
30,我認為台灣人不把駕駛當回事隨隨便便騎車開車聊天才是主因不像美國的飛行員
30,連啟動引擎都要照標準作業流程確認順序而台灣人駕駛習慣就很糟糕這種駕駛心態
30,難怪酒駕撞死人也不在意
31,這簡單
31,同條路再加個紅綠燈
31,測速照相區間測速
31,某党票比例不少都低端老人
31,敢限制老人不能開車
31,不想選舉了是不是
31,你第天當台灣人
31,菜逼八
32,大家好，我是八卦優文子啦
32,幹你娘
32,看到這個三峽的車禍意外真的嚇死我了，人家小妹妹放學好好的過斑馬線，居然
32,就這樣被垃圾老人撞飛了
32,行人到底是多可憐，都已經乖乖遵守交通規則了，還是直被車子撞死，都已經退不知道
32,幾百步了內
32,好笑的事，你政府沒辦法阻止垃圾開車撞人，至少要提供安全的過馬路空間吧
32,用天橋跟地下道給人走啊，你他媽的是有看過，汽車開上天橋撞死人的嗎
32,有沒有天橋拔光光的八卦
33,剛剛三峽的案件看了真的讓人氣憤又難過
33,少子化的時代那些孩童都是國家重要的資產
33,前幾天花蓮也件類似的案件
33,應該很多人都不相信車輛機械故障爆衝
33,全世界就你台灣車子會爆衝嗎
33,隔壁日本早就有高齡者駕照回訓的制度
33,甚至鼓勵高齡者主動繳回駕照以換取政府提供更多的社會福利
33,這幾年老人駕車爆衝的事件層出不窮
33,加上目前內閣滿意度最高的就是交通部長
33,有沒有可能推動駕照回訓制度
34,每次看到這些老畜生都快掛了然後帶走年輕幼童的生命真的很氣
34,都說民進黨爛
34,結果現在藍白過半也不修法
34,最好是退休後就不能開車
34,畢竟有補助公共交通費了
34,或是只能騎車出事還不會這麼嚴重
34,相信這次還是不會修法
35,媒體來源
35,聯合報
35,記者署名
35,張文馨
35,完整新聞標題
35,三峽重大車禍賴總統指示政院成立專案小組因應
35,完整新聞內文
35,有關新北市三峽區北大國小發生重大車禍事，總統府發言人郭雅慧今日表示，賴
35,清德總統聞訊後感到震驚且痛心，並表達高度關切，第時間指示行政院成立專案小組即
35,時掌握情勢，要求積極協調醫療資源，全力投入救護傷患與協助家屬，協助傷者早日康復
35,，並盡速釐清事故發生原因
35,新北市名歲老翁今天下午時許，開車行經三峽區北大國小前時，不明原因高速衝撞停
35,等紅燈的雙載機車，再撞上過馬路的名國中生，車輛接著再往前直衝國小前準備放學的
35,學童及家長，共造成人傷，其中人無生命跡象，肇事原因仍待調查
35,完整新聞連結或短網址不可用等轉載媒體
35,//////
35,備註
36,說真的，當務之急應該是馬上在高中職以下學校周圍道路上廣設減速帶吧
36,不管是要防治三峽這種垃圾老人，還是防堵像對岸那種故意開車衝撞學生殘害國家幼苗的事
36,情發生
36,設立減速帶應該有他的功效吧
36,就算上下課時間交通再塞，也比大家家裡的小孩發生這種悲劇來得好多了
37,三峽轎車衝撞學生人群重大事故賴清德震驚心痛全力救護
37,年月日
37,記者陶本和台北報導
37,/////
37,新北市三峽區國光街國成街口北大國小旁日下午時分放學時間傳出重大車禍
37,消防局通報資訊，輛自小客車衝撞學生人群，名學生受傷倒地，其中名學生無生
37,命跡象
37,對此，總統府發言人郭雅慧表示，總統賴清德聞訊後感到震驚且痛心，第時間
37,指示行政院成立專案小組掌握情勢，並下令協調醫療資源，全力投入救護傷患與協助家屬
37,根據新北市消防局時分通報資訊顯示，時分受理報案，時分趕抵現場，出動
37,車人，由組長指揮
37,現場情況為輛自小客車衝撞北大國小學生人群
37,有名學
37,生受傷倒地，其中有名學生無生命徵象
37,初步了解，該輛肇事的小客車衝撞約公尺，直到撞上中央分隔島後才停下
37,警方調查
37,，肇事駕駛高齡歲，撞擊後陷入昏迷，目前緊急送醫，詳細肇事原因仍待進步調查釐
37,清
37,對此，總統府發言人郭雅慧晚間表示，賴清德總統聞訊後感到震驚且痛心，並表達高度關
37,切，第時間指示行政院成立專案小組即時掌握情勢，要求積極協調醫療資源，全力投入
37,救護傷患與協助家屬，協助傷者早日康復，並儘速釐清事故發生原因
37,行政院發言人李慧芝也表示，行政院卓榮泰院長對於事故感到相當痛心，目前已指示衛福
37,部成立緊急醫療專案，積極協調醫療資源救護傷患，盼傷者早日康復，並請教育部內政
37,部及相關單位積極協助家屬，並儘速釐清事故發生原因
37,/////
37,▲三峽重大事故，歲駕駛因不明原因駕車暴衝
37,圖民眾提供
37,/////
37,▲三峽重大交通事故，鑑識人員採證中
37,圖記者陳以昇攝
37,心得
37,死者
38,是這樣啦
38,城武看到三峽那個新聞，有夠恐怖
38,不過更恐怖的事台灣最近堆老人開車亂撞跟殺人沒兩樣
38,放寬老人開車標準讓老人這樣直殺人，誰要負責啊
39,媒體來源
39,自由時報
39,記者署名
39,記者陳昀台北報導
39,完整新聞標題
39,三峽汽車爆衝撞學童賴總統震驚痛心指示政院成立專案小組
39,完整新聞內文
39,//
39,記者陳昀台北報導新北市三峽區北大國小旁下午時許發生重大車禍，總統府發言
39,人郭雅慧表示，賴清德總統聞訊後感到震驚且痛心，並表達高度關切，第時間指示行政
39,院成立專案小組即時掌握情勢，要求積極協調醫療資源，全力投入救護傷患與協助家屬，
39,協助傷者早日康復，並儘速釐清事故發生原因
39,新北市三峽區國光街國成街口北大國小旁，今天下午時許發生重大車禍
39,輛自小客
39,車不明原因衝撞多名路人，造成人輕重傷，其中人命危，警消趕抵發現現場有多名
39,學童受傷，隨即包紮並分批將患者送往醫院搶救，據了解，肇事駕駛是歲老翁，目前昏
39,迷也被送往醫院救治
39,完整新聞連結或短網址不可用等轉載媒體
39,//////
39,備註
40,剛剛在看三峽車禍的消息
40,結果看到還有人在問駕駛是不是中國人
40,///////
40,///////
40,/////_
40,這些人是怎樣啊
41,以下為介紹
41,池袋暴走事故的判決於年月日由東京地方法院宣判
41,被告飯塚幸三當時歲被
41,判處有期徒刑年，為實刑判決
41,這起事故發生於年月日，在東京都豐島區東池袋，輛轎車失控暴衝，導致對
41,母女喪生，另有人受傷，是起嚴重的交通事故
41,在審判過程中，飯塚被告主張事故是由車輛故障引起，並否認自己有過失
41,法院認為他缺
41,乏反省之意，這對量刑產生了不利影響
41,儘管考慮到他高齡以及已受到社會制裁的事實，
41,最終仍判處實刑
41,飯塚被告並未上訴，判決已經確定
41,台灣法官應該也會考量已經高齡
41,判個幾年就沒事了吧
41,哭哭
42,不用交通部阿
42,自己看台灣民眾怎麼處理
42,上次台南小女童往生後
42,全國傷心天交通部震怒撥錢改善人行道未禮讓行人重罰
42,全台交通大執法天職業駕駛直言不能開車
42,社會撻伐行人帝王行人再次被撞
42,你要改善什麼
42,反正台灣怎麼做到最後都有台灣玩法
42,行人地獄大執法變成三個枕木紋才舉發
42,畫人行道店家就不能做生意做庇護島就會開上去
42,前幾天高雄不是才個畫人行道堆人就不會開車了
42,反正台灣民意最大嘛你說
42,笑死人鬼島
43,不是只成立辦公室
43,專案小組
43,而是要跟國民說接下來的處理方式啊
43,事情發生原因
43,臨時處理
43,長期處理
43,不然新北市長自己出來說明啊
43,感覺總統跟新北市長都在睡，
43,不如問牢裡那個的，
43,說不定還比較有明確的處理方式
44,獨三峽重大車禍傳出人撞擊瞬間影像曝光
44,聯合報記者李定宇新北即時報導
44,新北市三峽區國光街與國成街口近某國小處，稍早疑似發生民眾駕駛自小客車暴衝事件，
44,造成現場多位民眾遭受撞擊，新北市消防局獲報後，立即派遣多輛救護車到場，初步估算
44,有名傷者
44,民眾提供車輛撞擊瞬間畫面，名帶小孩家長機車被撞爛，前面學童也群人被撞飛，畫
44,面相當驚悚
44,目前已知人
44,//////
44,_____
45,如題
45,三峽重大車禍
45,國家幼苗就這樣沒了
45,已經少子化了還出這種事
45,唉真的讓人覺得很悲哀
45,臺灣交通應該怎麼改善
